audio_number,sentence,surprisal_value
01,"cesarz rzymski niejednokrotnie pokazał, że przyjacielem korony polskiej nie jest.",12.175275802612305
02,"zamieszanie potęgował fakt, że niektórzy zachowywali neutralność, to znaczy było im wszystko jedno, kogo napadają i grabią, napadali i grabili wszystkich.",12.587239265441895
03,"a reynevan zacytował przed chwilą autorytety, które trochę jakby przeczą temu, co zeznajesz.",12.196048736572266
04,a tu zdeponowane przez ottona beessa sto guldenów.,11.379570960998535
05,"tak, jak to robiła nadal.",13.91242504119873
06,"zwyczaj nakazywał w odpowiedzi na takie niedomówienie zrobić mądrą minę, westchnąć i znacząco pokiwać głową.",10.493850708007812
07,"- nastraszyli mnie - powiedziała, patrząc w bok.",13.010479927062988
08,"wiedząc o tym, niektórzy donosili więc sami na siebie.",10.631258010864258
09,"rewolucja z chwilą upadku powstania warszawskiego w rzeczywistości już się dokonała, droga do niej była otwarta.",11.139785766601562
10,"reynevan tymczasem uciekał, a szło mu to tak, jak gdyby całe życie nie robił nic innego, tylko galopował w więzach.",9.36745548248291
11,"kości zostają rzucone, w rezultacie czego wydarza się to, co jakoby - nieuniknione i nieuchronne.",10.571242332458496
12,"rzecz w tym, że wszystko, absolutnie wszystko na świecie, ma trzy aury.",12.237515449523926
13,chyba że książę niedomaga.,10.774202346801758
14,"turystyka przyrodnicza przyciąga osoby lubiące spędzać czas na łonie natury, podziwiać krajobrazy, w tym dziką roślinność i zwierzęta.",11.546268463134766
15,"jak tylko dolatywał mnie zapach spalonego węgla, od razu stawał mi przed oczyma początek mojej służby.",11.527480125427246
16,trądem nas zarazić gotów! albo i czym gorszym!,12.03482437133789
17,"mniej więcej godzinę od momentu, kiedy zamilkły ostatnie strzały, wolf powiedział, że pojedzie na zwiad i pojechał sam.",12.10257339477539
18,"a im większy sekret, tym większa nagroda.",11.54622745513916
19,"mówię ci to, byś znał moje zamiary, choć i tak z pewnością domyśliłeś się ich po pytaniach, które stawiałem schillingowi.",12.119481086730957
20,"pomiędzy nią a resztą pracowników nastąpiła krótka przerwa w czasie, wynikła z tego, że wszyscy najpierw podążyli w kierunku źródła hałasu.",10.560190200805664
21,ale przecież on tu diabli wiedzą jak narozrabia!,11.317957878112793
22,"i gdyby chociaż los zesłał mu skruchę, gorącą skruchę, która łamie serce, spędza sen z powiek, taką skruchę, której straszliwe męczarnie nasuwają myśl o pętli i topieli!",11.213041305541992
23,ani tym bardziej na trzymających stronę albrechta katolików.,12.1693696975708
24,"zanim się połapią, że to była rozgrywka.",12.080021858215332
25,"do sierotek, które, jak głosi fama, ostro maszerują na północ i lada moment tu będą.",11.37336254119873
26,"w taki oto sposób wiem, kto położył kres romansowi wirydy hornig.",11.10422420501709
27,w każdym razie na węgry wywieźć cię nie zdołam.,14.453385353088379
28,"nawiasem mówiąc, musiałem z tym doktorem uważać.",9.53032398223877
29,"umiem załatwiać takie rzeczy. mam to, można powiedzieć, we krwi. od pokoleń.",11.062110900878906
30,"regułą, a w gruncie rzeczy zasługą przeoryszy było to, że każdy z gości występował z kazaniem lub wykładem dla mniszek.",11.422592163085938
31,"okazało się, że tempe, jak wiadomo, był u szczytu, pani osłabędzka umarła na serce w nędzy.",12.433034896850586
32,"podejrzanych nadal było ośniu ludzi, z czego dwoje, moim zdaniem, można wykluczyć z powodów psychologicznych.",12.1331148147583
33,"zrobił to jednym gestem i jednym słowem, reynevan w życiu nie widział równie sprawnie rzuconego zaklęcia.",10.945908546447754
34,"ot, co znaczy wiedzieć, na jakiego konia postawić!",12.434117317199707
35,"wygląda na to, że lubimy takie pochwały.",11.150474548339844
36,"a, na miłosierdzie boskie! - zawołał - czy to ziemia jest rajem, żeby od niej wszystkiego dobrego razem wymagać było można!",11.72719669342041
37,"odróżnia nas... tak..., więc jednak",12.588790893554688
38,odkrycie harvey'a ma obok praktycznego także i filozoficzne znaczenie.,12.125336647033691
39,"pozwoliłem. bo co on, zniewolony czy jak? pogadaliśmy.",12.858859062194824
40,"sami własny klasztor niszczą, w dodatku z ochotą.",13.036993980407715
41,to było nieomalże ostatnie nasze zwycięstwo.,12.381953239440918
42,jej nic podobnego przydarzyć się nie mogło więc to miłosierdzie nie budziło w niej żadnych osobistych uczuć czy też obaw.,11.366028785705566
43,"gdybyś nie palił… co tam, i tak wystarczy tylko na kartofle i chleb.",11.341670989990234
44,"za to zająć się czasami którąś z dziewcząt ze służby, lecz nie inaczej jak w poufnym porozumieniu z marfą pietrowna.",12.373246192932129
45,"ale baśka moja nieledwie w waćpanny leciech dlatego poczuwam się w tym aby zaś miała czasem jakowąś uciechę grzeczną, a młodemu wiekowi przystojną.",10.977150917053223
46,"jeden z praskich mentorów reynevana usiłował dowodzić odnośnie lotów czarodziejskich, a to mianowicie, że są one poddane kontroli mentalnej wysmarowanej maścią lotną czarownicy lub czarownika.",10.4143705368042
47,"a zasię! to była, podobna, pierwsza kokota w warszawie!",11.579211235046387
48,"ha! orłowe gniazdo, ale nie wiadomo, czy się orzeł w nim znajdzie, jako był wiśniowiecki, czy jeno wrona?.",12.031349182128906
49,"jeden z krzyżaków, nie bacząc na rozkaz brania żywcem, zamierzył się do pchnięcia w gardło.",12.125286102294922
50,"tę świątynię na szczycie wzgórza wzniesiono w końcu ix wieku, za czasów panowania króla yasovarmana.",10.453118324279785
51,"wiosna idzie, pomyślał sobie reynevan, idąc u boku szarleja rozmokłą miedzą.",9.594735145568848
52,"nieboskłon ściemniał aż do głębokiego mroku zimnego kosmosu, weszli na orbitę ziemi.",10.996313095092773
53,"ponieważ strome stoki są w stanie utrzymać jedynie ograniczoną ilość śniegu, jego nadmiar będzie staczał się w postaci lawiny.",9.39381217956543
54,od strony bramy wrocławskiej słychać było strzały.,11.941360473632812
55,"na prostokątnej generalskiej twarzy lemchena pojawiły się zmarszczki oznaczające ni to życzliwy uśmiech, ni to strapienie z powodu odrażającej aury, lub też, być może, z trudem opanowywaną chęć kichnięcia.",11.423015594482422
56,"na mocy rozejmu i układu, wymuszonego na księciu oławskim ludwiku, udostępniono im szpital świętego świerada.",12.435774803161621
57,"tak więc przerwy robili na świeżym powietrzu. niedaleko za siewierzem, pośród przydrożnej brzeziny.",11.246452331542969
58,w całym kraju korzysta z porady lekarskiej na koszt właścicieli 41% a wcale jej nie doznaje 59.,11.554213523864746
59,"zadowolę się jałmużną, datkiem jakim skromnym, a i to nie z góry bynajmniej, lecz po skończonym dziele.",11.665328979492188
60,klasyfikacji skazanych dokonuje się mając na uwadze następujące cechy.,11.487068176269531
