audio_number,sentence,surprisal_value
01,"сашо бе возил с него чичо си не веднъж и не два пъти, носеше винаги в себе си резервните ключове.",11.101418495178223
02,"сега му е все едно дъщеря, не-дъщеря.",13.477193832397461
03,"зад залостената врата беше девети номер, в който току-що влезе александър григориевич.",12.637855529785156
04,"та нали ако кажеш на дивака да остави тоягата, той още начаса, напук, ще направи още три такива тояги…",11.985291481018066
05,"къде изчезна и, защо – и досега е загадка. а бандата му се разпадна – кой накъдето му видят очите.",12.780304908752441
06,в отговор игор само въздъхна.,13.185053825378418
07,валя побутна шефа встрани.,14.116683006286621
08,"всі хочуть командувати, але ніхто не хоче звалити на себе си відповідальність…",11.541153907775879
09,"марк александрович забеляза недоволството на серго, беше огорчен, но знаеше, че серго не е отмъстителен, нито злопаметен, още повече че по същество марк александрович беше прав и не беше виновен.",12.568772315979004
10,татко цял живот само с фьодор михайлович се е занимавал.,12.00896167755127
11,"парагвай, преди наричан „гигантската провинция на индия“, е роден през 16-ти век в резултат на срещата на испанските завоеватели с местните групи.",11.764039039611816
12,"няма вече такива девойки на света, помисли си той.",12.766764640808105
13,освен да… – взе синята папка от масата. дръжте.,12.210711479187012
14,"задържани са от вас наши кораби, в това число и „малака“, наета за рейс до япония.",12.947794914245605
15,това стана ясно още щом минахме през портала.,13.035026550292969
16,"салов съобщи на панафидин, че в района на шикотан мъглата се задържа понякога месец, че даже и повече…",11.225692749023438
17,"след като информацията, оповестена от журналиста макис триантафилопулос в популярното му телевизионно предаване „zoungla“ по алфа тв, депутатът и адвокат, петрос мантувалос, се отказа от поста си.",11.995733261108398
18,"колкото повече мислех по този въпрос, толкова повече се убеждавах, че познавам младежа.",10.918335914611816
19,"тигърът, като добре закръглен атлет, може да се катери (макар и не добре), да плува, да прави огромни скокове и да дърпа със силата на петима здрави човека.",10.15078067779541
20,"да не би да ми стане по-леко от това, че е машина.",12.666831016540527
21,"та нали те нямаха нищо, освен него!",12.756012916564941
22,"и което беше най-лошото, да бъде съучастник или най-малкото свидетел на бандитското спиране на един от товарните влакове по този участък.",9.601243019104004
23,"още повече че карл не е роден в мадрид, нито изобщо в испания.",11.50809383392334
24,"това обаче е много трудна задача за решаване и ще са нужни много години, преди да видим изграждането на полезни реактори за синтез.",11.784069061279297
25,според слухове граничните ни земи с баязид били размирни и той не смеел да изтегли оттам най-добрата си войска.,10.006824493408203
26,по такъв начин този проблем с военните превози е решен.,10.256293296813965
27,във всеки случай сега съм сам и изоставен.,13.205493927001953
28,и между другото въпросният „един час време отдавна беше минал.,11.96992015838623
29,"всичко това спомогна най-вече и за този неочакван случай, благодарение на който сега се променя, може да се каже, цялата ни съдба.",10.57110595703125
30,"в същност тя не „заставаше, а някак витаеше наоколо му като една сянка, която неочаквано беше добила едно ново измерение, плътността.",12.478182792663574
31,както е известно светът не е останал без добри хора.,12.079752922058105
32,"сега той почна едно сепнато pizzicato, което по негово мнение изображаваше песента: „открадна-ла сей, бабината, сла-сланин-каа, сланинка, откраднала сей бабината сланинка“… която „сланинка “цяла е открадната от чешката „slaninka“.",10.15281867980957
33,"с една дума, всички бяха затънали в работа до гуша…",12.048072814941406
34,"дето се вика, останаха с пръст и устата!",13.105416297912598
35,"момичето бързешком извади парите и ги хвърли в найлоновия плик, но съдейки по всичко, сумата бе смехотворна.",9.475626945495605
36,"пишете, за бога, пишете, ще чакам!",11.871404647827148
37,но все пак… моля ви да си спомните накъде хукна другият престъпник.,11.715506553649902
38,тази операция е скъпа още и заради бащините чувства.,13.191712379455566
39,за кавказ ли е? равнодушно попита колка.,12.922516822814941
40,"ами той, ако искаш да знаеш, дори мислите ни чува! камо ли разговорите…",8.687070846557617
41,"той имаше сбръчкано личице, редички бели косици и напрегнат и едва ли не страхлив поглед.",9.78170108795166
42,"от двайсет и пет години насам, професоре, кълна ви се, нищо подобно.",10.310125350952148
43,"добре де, пошегувах се, имам само едно огледало и то се намира в антрето…",11.352998733520508
44,"— без друго тая мръсница — каза той — ще да е изпуснала писалката из ливадата — и заедно с коста отидоха нататък, наведени из ливадата.",11.757100105285645
45,"колкото за самата епидемия, той не се вълнуваше никак от нея и я считаше почти като сезонно явление, подобно на лятната диария по кърмачетата.",11.714456558227539
46,"това още преди две години и половина го знаех и две години и половина вече мисля за това именно, че «дунечка много неща може да понесе».",11.040138244628906
47,дебнете ме? как ли пък не! знаех си аз!,11.460128784179688
48,"почваше да й се струва, че това не е непознат, незнайно как попаднал в тяхното семейство летец, а нейният миша, че не тоя неочакван гост, а нейният мъж, с когото бе прекарала всичко на всичко една пролет.",10.448944091796875
49,"въпреки че вечерта бе топла, мириса потръпна и потърси ръката на брант.",10.67436408996582
50,първите истински телескопи в европа обаче са направени в края на 16-ти век.,9.276764869689941
51,"затова, без да се колебая пито миг, ще направя „кръгом “на място в снега и ще тръгна редом с моята нова позната.",11.167611122131348
52,"считам, че можем да отстъпваме и по-нататък, чак до харбин.",9.400558471679688
53,"то беше луксозно, от махагон и с бронзова дръжка във вид на сфинкс върху пиедестал.",10.419350624084473
54,поне от страна на булката.,12.995327949523926
55,а по повод на вашия татко приемете най-искрените ми.,12.152931213378906
56,по силата на различни причини това е много неудобно.,11.794295310974121
57,"пастирчето отишло с магарето за дърва, недалече от кошарите.",10.297065734863281
58,"или как другояче да ви разбираме – нека вълците да се размножават, да разкъсват нашите стада, да живеят за сметка на народната собственост?",12.343155860900879
59,това ще е полезно и за самия сарафин при преминаването му в следващото битие след свършването на земния му път.,10.88762378692627
60,"трето, с оглед на обстановката уточнявам плана си за действие.",12.161613464355469
